{
  "id": "sql-key-lookup-and-covering-index-interview",
  "stack": "fullstack-dotnet-developer",
  "concept": "sql-key-lookup-and-covering-index",
  "lesson": "w04-l01",
  "version": 1,
  "scenario": "A filtered SQL query performs many key lookups. How would you investigate a covering index?",
  "rubric": [
    "Inspect the execution plan and required predicate and output columns.",
    "Explain how included columns can avoid lookups for that query.",
    "Weigh index size and write maintenance against measured read benefit.",
    "Explain the approach in a clear sequence with assumptions and an example."
  ],
  "misconceptions": [
    "Adding every column to every index always improves performance."
  ],
  "sources": [
    {
      "url": "https://learn.microsoft.com/en-us/sql/relational-databases/sql-server-index-design-guide?view=sql-server-ver17",
      "title": "SQL Server index design",
      "publisher": "Microsoft",
      "accessed": "2026-10-11",
      "claim": "Reviewed scenario and rubric rely on the documented behavior above."
    }
  ],
  "follow_ups": [
    {
      "id": "writes",
      "scenario": "What would change for a write-heavy table?",
      "rubric": [
        "Explain additional write and storage costs and validate with workload measurements."
      ]
    }
  ]
}
