{
  "id": "w09-l03-csrf-tokens-interview",
  "stack": "full-stack-web-dev",
  "concept": "w09-l03-csrf-tokens",
  "lesson": "w09-l03",
  "version": 1,
  "scenario": "A browser attaches session cookies automatically. How do you protect a state-changing endpoint from CSRF?",
  "rubric": [
    "Explain why authenticated cookies alone do not establish user intent.",
    "Validate an appropriate CSRF token tied to the authenticated context.",
    "Describe origin checks or SameSite as defense in depth rather than universal replacements.",
    "Explain the approach in a clear sequence with assumptions and an example."
  ],
  "misconceptions": [
    "A state-changing GET is safe because it has no request body."
  ],
  "sources": [
    {
      "url": "https://cheatsheetseries.owasp.org/cheatsheets/Cross-Site_Request_Forgery_Prevention_Cheat_Sheet.html",
      "title": "CSRF prevention",
      "publisher": "OWASP",
      "accessed": "2026-10-11",
      "claim": "Reviewed scenario and rubric rely on the documented behavior above."
    }
  ],
  "follow_ups": [
    {
      "id": "xss",
      "scenario": "Can CSRF tokens compensate for arbitrary script execution on the same origin?",
      "rubric": [
        "Explain that XSS can undermine CSRF defenses and needs separate prevention."
      ]
    }
  ]
}
