{
  "id": "viewmodelstore-config-change-retention-interview",
  "stack": "android-developer",
  "concept": "viewmodelstore-config-change-retention",
  "lesson": "w04-l01",
  "version": 1,
  "scenario": "A screen loses its loading state when the phone rotates. Where would you hold that state, and what changes if the process is killed?",
  "rubric": [
    "Use a ViewModel for screen business state across configuration changes.",
    "Separate lifecycle-dependent UI operations from business state.",
    "Explain that process death needs persisted or saved state rather than relying on ViewModel memory."
  ],
  "misconceptions": [
    "A ViewModel survives process death."
  ],
  "sources": [
    {
      "url": "https://developer.android.com/topic/architecture/ui-layer/stateholders",
      "title": "State holders and UI state",
      "publisher": "Google",
      "accessed": "2026-10-11",
      "claim": "Business state can be held outside the UI lifecycle; ViewModel retains state across recreation."
    }
  ],
  "follow_ups": [
    {
      "id": "process-death",
      "scenario": "How would you restore a partially completed screen after process death?",
      "rubric": [
        "Persist the required durable state and reconstruct the screen."
      ]
    }
  ]
}
