{
  "id": "injected-external-coroutine-scope-interview",
  "stack": "android-developer",
  "concept": "injected-external-coroutine-scope",
  "lesson": "w02-l02",
  "version": 1,
  "scenario": "Saving a bookmark must finish even if its screen closes. How would you scope and test that work?",
  "rubric": [
    "Choose an explicitly owned scope whose lifetime meets the requirement.",
    "Explain why screen-bound cancellation may be inappropriate.",
    "Inject scope and dispatchers for deterministic tests and describe cancellation ownership.",
    "Explain the approach in a clear sequence with assumptions and an example."
  ],
  "misconceptions": [
    "GlobalScope is the best default for all background work."
  ],
  "sources": [
    {
      "url": "https://developer.android.com/kotlin/coroutines/coroutines-best-practices",
      "title": "Coroutine scope best practices",
      "publisher": "Google",
      "accessed": "2026-10-11",
      "claim": "Reviewed scenario and rubric rely on the documented behavior above."
    }
  ],
  "follow_ups": [
    {
      "id": "lifetime",
      "scenario": "Who should own cancellation of that longer-lived work?",
      "rubric": [
        "Name the lifetime owner and explain graceful cancellation rather than an unowned global task."
      ]
    }
  ]
}
