{
  "id": "w02-l02-field-and-model-validators-interview",
  "stack": "agentic-ai-engineer",
  "concept": "w02-l02-field-and-model-validators",
  "lesson": "w02-l02",
  "version": 1,
  "scenario": "A tool input has individually valid start and end fields but the end precedes the start. Where would you validate it?",
  "rubric": [
    "Use field validation for individual constraints and model validation for cross-field rules.",
    "Return a clear validation error before tool execution.",
    "Explain why schema shape alone does not enforce every business invariant.",
    "Explain the approach in a clear sequence with assumptions and an example."
  ],
  "misconceptions": [
    "Valid field types guarantee the whole business operation is valid."
  ],
  "sources": [
    {
      "url": "https://docs.pydantic.dev/latest/concepts/validators/",
      "title": "Pydantic validators",
      "publisher": "Pydantic",
      "accessed": "2026-10-11",
      "claim": "Use field validation for individual constraints and model validation for cross-field rules. Return a clear validation error before tool execution."
    }
  ],
  "follow_ups": [
    {
      "id": "feedback",
      "scenario": "How would validation errors help the assistant correct a proposed call?",
      "rubric": [
        "Provide bounded useful errors without executing invalid input."
      ]
    }
  ]
}
