{
  "id": "w08-l03-transaction-snapshot-interview",
  "stack": "full-stack-web-dev",
  "concept": "w08-l03-transaction-snapshot",
  "lesson": "w08-l03",
  "version": 1,
  "scenario": "Two reads in one PostgreSQL transaction return different committed values. Explain the default isolation behavior.",
  "rubric": [
    "Read Committed takes a fresh snapshot for each statement.",
    "Explain how a concurrent commit can become visible to the later statement.",
    "Contrast Repeatable Read and discuss retry requirements for stricter isolation.",
    "Explain the approach in a clear sequence with assumptions and an example."
  ],
  "misconceptions": [
    "Every transaction automatically uses one fixed snapshot for all statements."
  ],
  "sources": [
    {
      "url": "https://www.postgresql.org/docs/current/transaction-iso.html",
      "title": "PostgreSQL transaction isolation",
      "publisher": "PostgreSQL",
      "accessed": "2026-10-11",
      "claim": "Reviewed scenario and rubric rely on the documented behavior above."
    }
  ],
  "follow_ups": [
    {
      "id": "retry",
      "scenario": "Why might an application need to retry a stricter transaction?",
      "rubric": [
        "Explain serialization failures and retrying the complete transaction."
      ]
    }
  ]
}
