{
  "id": "w02-l02-json-schema-for-tools-interview",
  "stack": "agentic-ai-engineer",
  "concept": "w02-l02-json-schema-for-tools",
  "lesson": "w02-l02",
  "version": 2,
  "scenario": "An assistant proposes a tool call to change a booking. How would you define its arguments and handle the proposed call safely?",
  "rubric": [
    "Define a function declaration with typed arguments and required fields.",
    "Validate the proposed arguments before application execution.",
    "Keep actual execution and authorization in application code rather than trusting model output.",
    "Explain the approach in a clear sequence with assumptions and an example."
  ],
  "misconceptions": [
    "A model function call executes the application function automatically."
  ],
  "sources": [
    {
      "url": "https://ai.google.dev/gemini-api/docs/function-calling",
      "title": "Function calling with Gemini",
      "publisher": "Google",
      "accessed": "2026-10-11",
      "claim": "Function declarations describe tool parameters; application code handles executing proposed calls."
    }
  ],
  "follow_ups": [
    {
      "id": "invalid-arguments",
      "scenario": "How should the application handle missing or invalid tool arguments?",
      "rubric": [
        "Reject invalid arguments and request correction without executing the action."
      ]
    }
  ]
}
