{
  "id": "w10-l02-access-controlled-retrieval-interview",
  "stack": "agentic-ai-engineer",
  "concept": "w10-l02-access-controlled-retrieval",
  "lesson": "w10-l02",
  "version": 1,
  "scenario": "A retrieval assistant serves multiple teams. How do you prevent one team from receiving another team's documents?",
  "rubric": [
    "Derive authorized principals from trusted authentication.",
    "Apply access-control filtering during retrieval before context reaches the model.",
    "Explain that model instructions cannot replace application authorization.",
    "Explain the approach in a clear sequence with assumptions and an example."
  ],
  "misconceptions": [
    "Asking the model to hide forbidden documents makes unrestricted retrieval safe."
  ],
  "sources": [
    {
      "url": "https://learn.microsoft.com/en-us/azure/search/search-security-trimming-for-azure-search",
      "title": "Search security filters",
      "publisher": "Microsoft",
      "accessed": "2026-10-11",
      "claim": "Reviewed scenario and rubric rely on the documented behavior above."
    }
  ],
  "follow_ups": [
    {
      "id": "filter",
      "scenario": "Can the client choose arbitrary security principals in the search filter?",
      "rubric": [
        "Derive and validate principals on the trusted server boundary."
      ]
    }
  ]
}
