{
  "id": "stateflow-equality-conflation-interview",
  "stack": "android-developer",
  "concept": "stateflow-equality-conflation",
  "lesson": "w03-l01",
  "version": 1,
  "scenario": "A StateFlow UI misses intermediate rapidly emitted states. Is this necessarily a bug?",
  "rubric": [
    "StateFlow conflates state and uses equality to suppress equivalent updates.",
    "Distinguish latest state from an event log that needs every event.",
    "Explain a suitable event or state design with its delivery requirements.",
    "Explain the approach in a clear sequence with assumptions and an example."
  ],
  "misconceptions": [
    "StateFlow guarantees every intermediate update is collected."
  ],
  "sources": [
    {
      "url": "https://kotlinlang.org/api/kotlinx.coroutines/kotlinx-coroutines-core/kotlinx.coroutines.flow/-state-flow/",
      "title": "StateFlow semantics",
      "publisher": "JetBrains",
      "accessed": "2026-10-11",
      "claim": "StateFlow conflates state and uses equality to suppress equivalent updates. Distinguish latest state from an event log that needs every event."
    }
  ],
  "follow_ups": [
    {
      "id": "equal-state",
      "scenario": "What if you assign another value equal to the current state?",
      "rubric": [
        "Explain equality suppression and why immutable state updates matter."
      ]
    }
  ]
}
